"Title","Description","URL","State","Type of Report ","City","Zip","Latitude","Longitude"
"Clery Act Report: University of Arkansas",,"http://studentaid.ed.gov/about/data-center/school/clery-act#arkansas","Arkansas","Clery ","Fayetteville",72701,36.067832,-94.173655
"Title IX: Tehachapi Public Schools Press Release","Departments of Justice and Education Reach Agreement with Tehachapi Calif. Public Schools to Resolve Harassment Allegations","http://www.ed.gov/news/press-releases/departments-justice-and-education-reach-agreement-tehachapi-calif-public-schools","California","Title IX","Tehachapi",93561,35.121373,-118.43302
"Letter of Findings in Tehachapi Unified School District (E.D. Cal.)","Sex based discrimination at educational institutions","http://www.justice.gov/crt/about/edu/documents/tehachapiletter.pdf","California","Department of Justice ","Tehachapi",93561,35.121373,-118.43302
"Clery Act Report: Ashford University",,"http://studentaid.ed.gov/about/data-center/school/clery-act#ashford","California","Clery ","San Diego",92123,32.8264972,-117.1351586
"Clery Act Report: California State University",,"http://studentaid.ed.gov/about/data-center/school/clery-act#calstate","California","Clery ","Long Beach",90802,33.764235,-118.201306
"Clery Act Report: Palo Alto College",,"http://studentaid.ed.gov/about/data-center/school/clery-act#paloalto","California","Clery ","Palo Alto",94304,37.3821803,-122.1874909
"Clery Act Report: Saint Mary's College of California",,"http://studentaid.ed.gov/about/data-center/school/clery-act#stmaryca","California","Clery ","Moraga",94556,37.841201,-122.108703
"Clery Act Report: University of California- Davis",,"http://studentaid.ed.gov/about/data-center/school/clery-act#ucdavis","California","Clery ","Davis",95616,38.538232,-121.761712
"Clery Act Report: University of California- Los Angeles",,"http://studentaid.ed.gov/about/data-center/school/clery-act#ucla","California","Clery ","Los Angeles",90095,34.068921,-118.445181
"Clery Act Report: University of California- San Diego",,"http://studentaid.ed.gov/about/data-center/school/clery-act#ucsd","California","Clery ","La Jolla",92093,32.880398,-117.242188
"Title IX: West Contra Costa Unified School District Compliance Review","West Contra Costa Compliance Review","http://www2.ed.gov/about/offices/list/ocr/docs/investigations/09095001-a.html","California ","Title IX","Richmond",94804,37.933832,-122.358491
"Title IX: West Contra Costa Unified School District Resolution Agreement","West Contra Costa Resolution Agreement","http://www2.ed.gov/about/offices/list/ocr/docs/investigations/09095001-b.html","California ","Title IX","Richmond",94804,37.933832,-122.358491
"Title IX: Tehachapi Public Schools Compliance Resolution","Tehachapi Public Schools Compliance Resolution","http://www2.ed.gov/about/offices/list/ocr/docs/investigations/09111031-a.html","California ","Title IX","Tehachapi",93561,35.121373,-118.43302
"Title IX: Tehachapi Public Schools Resolution Agreement","Tehachapi Public Schools Resolution Agreement","http://www2.ed.gov/about/offices/list/ocr/docs/investigations/09111031-b.html","California ","Title IX","Tehachapi",93561,35.121373,-118.43302
"Title IX: Yale University Press Release","U.S. Department of Education Announces Resolution of Yale University Civil Rights Investigation","http://www.ed.gov/news/press-releases/us-department-education-announces-resolution-yale-university-civil-rights-invest","Connecticut","Title IX","New Haven",6520,41.316324,-72.922343
"Title IX: Yale University Compliance Resolution","Yale University Compliance Resolution","http://www2.ed.gov/about/offices/list/ocr/docs/investigations/01112027-a.html","Connecticut","Title IX","New Haven",6520,41.316324,-72.922343
"Title IX: Yale Univeristy Resolution Agreement","Yale University Resolution Agreement","http://www2.ed.gov/about/offices/list/ocr/docs/investigations/01112027-b.html","Connecticut","Title IX","New Haven",6520,41.316324,-72.922343
"Clery Act Report: Yale University",,"http://studentaid.ed.gov/about/data-center/school/clery-act#yale","Connecticut","Clery ","New Haven",6520,41.316324,-72.922343
"Clery Act Report: Delaware State University",,"http://studentaid.ed.gov/about/data-center/school/clery-act#dsu","Delaware","Clery ","Dover",19901,39.18688,-75.542057
"Clery Act Report: University of Delaware",,"http://studentaid.ed.gov/about/data-center/school/clery-act#uofd","Delaware","Clery ","Newark",19716,39.67795,-75.750611
"Clery Act Report: Wesley College",,"http://studentaid.ed.gov/about/data-center/school/clery-act#wesley","Delaware","Clery ","Dover",19901,39.163115,-75.527609
"Title IX: Hillsborough County School District Compliance Resolution","Hillsborough County School District Compliance Resolution","http://www2.ed.gov/about/offices/list/ocr/docs/investigations/04095002-a.html","Florida","Title IX","Tampa",33602,27.949249,-82.452184
"Title IX: Hillsborough County School District Resolution Agreement","Hillsborough County School District Resolution Agreement","http://www2.ed.gov/about/offices/list/ocr/docs/investigations/04095002-b.html","Florida","Title IX","Tampa",33602,27.949249,-82.452184
"Clery Act Report: Florida State University",,"http://studentaid.ed.gov/about/data-center/school/clery-act#floridasu","Florida","Clery ","Tallahassee",32306,30.441878,-84.298489
"Title IX: Idaho Falls School District","Idaho Falls School District","http://www2.ed.gov/about/offices/list/ocr/docs/investigations/10095002.html","Idaho","Title IX","Idaho Falls",83401,43.493652,-112.019073
"Clery Act Report: Northern Illinois University",,"http://studentaid.ed.gov/about/data-center/school/clery-act#niu","Illinois","Clery ","DeKalb",60115,41.934299,-88.773718
"Title IX: Evansville-Vanderburgh School Corporation Press Release","Office for Civil Rights Announces Resolution of Title IX Compliance Review Involving the Evansville-Vanderburgh School Corporation in Evansville Ind.","http://www.ed.gov/news/press-releases/office-civil-rights-announces-resolution-title-ix-compliance-review-involving-ev","Indiana","Title IX","Evansville",47713,37.9723424,-87.5639389
"Title IX: Evansville-Vanderburgh School Corporation Compliance Review","Evansville-Vanderburgh Compliance Review","http://www2.ed.gov/about/offices/list/ocr/docs/investigations/05115002-a.html","Indiana","Title IX","Evansville",47713,37.9723424,-87.5639389
"Title IX: Evansville-Vanderburgh School Corporation Resolution Agreement","Evansville-Vanderburgh Resolution Agreement","http://www2.ed.gov/about/offices/list/ocr/docs/investigations/05115002-b.html","Indiana","Title IX","Evansville",47713,37.9723424,-87.5639389
"Title IX: Butler University Press Release","U.S. Education Department Reaches Agreement with Butler University to Resolve Title IX Athletics Compliance Review","http://www.ed.gov/news/press-releases/us-education-department-reaches-agreement-butler-university-resolve-title-ix-ath","Indiana","Title IX","Indianapolis",46208,39.8396,-86.16972
"Title IX: Butler University Compliance Review","Butler University Compliance Review","http://www2.ed.gov/about/offices/list/ocr/docs/investigations/05116001-a.html","Indiana","Title IX","Indianapolis",46208,39.8396,-86.16972
"Title IX: Butler University Resolution Agreement","Butler University Resolution Agreement","http://www2.ed.gov/about/offices/list/ocr/docs/investigations/05116001-b.html","Indiana","Title IX","Indianapolis",46208,39.8396,-86.16972
"Title IX: University of Notre Dame Press Release ","Civil Rights Office Announces Settlement Agreement on Discrimination Investigation at Notre Dame","http://www.ed.gov/news/press-releases/civil-rights-office-announces-settlement-agreement-discrimination-investigation-","Indiana","Title IX","Notre Dame",46556,41.705219,-86.235307
"Title IX: University of Notre Dame Compliance Review","University of Notre Dame Compliance Review","http://www2.ed.gov/about/offices/list/ocr/docs/investigations/05072011-a.html","Indiana","Title IX","Notre Dame",46556,41.705219,-86.235307
"Title IX: University of Notre Dame Resolution Agreement","University of Notre Dame Resolution Agreement","http://www2.ed.gov/about/offices/list/ocr/docs/investigations/05072011-b.html","Indiana","Title IX","Notre Dame",46556,41.705219,-86.235307
"Title IX: Ball State University","Ball State University","http://www2.ed.gov/about/offices/list/ocr/docs/investigations/05096001.html","Indiana","Title IX","Muncie",47306,40.197237,-85.408841
"Clery Act Report: Saint Mary's College- Notre Dame",,"http://studentaid.ed.gov/about/data-center/school/clery-act#stmarynd","Indiana","Clery ","Notre Dame",46556,41.70833,-86.258123
"Clery Act Report: University of Northern Iowa",,"http://studentaid.ed.gov/about/data-center/school/clery-act#uni","Iowa","Clery ","Cedar Falls",50614,42.513698,-92.463516
"Title IX: Putman v. Board of Education of Somerset Indep. School (E.D. Ky.) -Amicus Brief","Sex based discrimination at educational institutions","http://www.justice.gov/crt/about/edu/documents/putmanbr1.php","Kentucky","Department of Justice ","Somerset",42501,37.095025,-84.601903
"Title IX: Louisiana State University Compliance Resolution","Louisiana State University Compliance Review","http://www2.ed.gov/about/offices/list/ocr/docs/investigations/06116001-a.html","Louisiana","Title IX","Baton Rouge",70803,30.413258,-91.180002
"Clery Act Report: Louisiana State University",,"http://studentaid.ed.gov/about/data-center/school/clery-act#lsu","Louisiana","Clery ","Baton Rouge",70803,30.413258,-91.180002
"Title IX: Louisiana State University Resolution Agreement","Louisiana State University Resolution Agreement","http://www2.ed.gov/about/offices/list/ocr/docs/investigations/06116001-b.html","Lousiana","Title IX","Baton Rouge",70803,30.413258,-91.180002
"Title IX: Compliance Review: Portland Maine Public Schools Press Release","U.S. Education Department Reaches Agreement with Portland Maine Public Schools to Increase Athletic Opportunities for Girls","http://www.ed.gov/news/press-releases/us-education-department-reaches-agreement-portland-maine-public-schools-increase","Maine","Title IX","Portland",4103,43.6971768,-70.2947572
"Title IX: Portland Public Schools Compliance Resolution","Portland Maine Compliance Review","http://www2.ed.gov/about/offices/list/ocr/docs/investigations/01115001-a.html","Maine","Title IX","Portland",4103,43.6971768,-70.2947572
"Title IX: Portland Public Schools Resolution Agreement","Portland Maine Resolution Agreement","http://www2.ed.gov/about/offices/list/ocr/docs/investigations/01115001-b.html","Maine","Title IX","Portland",4103,43.6971768,-70.2947572
"Clery Act Report: Mount Saint Mary College",,"http://studentaid.ed.gov/about/data-center/school/clery-act#msmary","NY","Clery ","Newburgh",12550,41.510927,-74.013751
"Title IX: Hingham Public School District Compliance Resolution","Hingham Public Schools Compliance Review","http://www2.ed.gov/about/offices/list/ocr/docs/investigations/01105003-a.html","Massachusetts"," Title IX","Hingham",2043,42.2318299,-70.8869475
"Title IX: Hingham Public School District Resolution Agreement","Hingham Public Schools Resolution Agreement","http://www2.ed.gov/about/offices/list/ocr/docs/investigations/01105003-b.html","Massachusetts","Title IX","Hingham",2043,42.2318299,-70.8869475
"Title IX: Merrimack College Press Release","Merrimack College Press Release","http://www.ed.gov/news/press-releases/office-civil-rights-announces-resolution-compliance-review-involving-merrimack-c","Massachusetts","Title IX","North Andover",1845,42.667705,-71.122571
"Title IX: Merrimack College Compliance Resolution","Merrimack College Compliance Resolution","http://www2.ed.gov/about/offices/list/ocr/docs/investigations/01106001-a.html","Massachusetts","Title IX","North Andover",1845,42.667705,-71.122571
"Title IX: Merrimack College Resolution Agreement","Merrimack College Resolution Agreeement","http://www2.ed.gov/about/offices/list/ocr/docs/investigations/01106001-b.html","Massachusetts","Title IX","North Andover",1845,42.667705,-71.122571
"Title IX: Eastern Michigan University","Eastern Michigan University","http://www2.ed.gov/about/offices/list/ocr/docs/investigations/15096002.html","Michigan","Title IX","Ypsilanti",48197,42.250551,-83.62469
"Clery Act Report: Eastern Michigan University",,"http://studentaid.ed.gov/about/data-center/school/clery-act#emich","Michigan","Clery ","Ypsilanti",48197,42.250551,-83.62469
"Clery Act Report: University of Michigan",,"http://studentaid.ed.gov/about/data-center/school/clery-act#michigan","Michigan","Clery ","Ann Arbor",48109,42.278058,-83.738226
"Title IX: Anoka-Hennepin School District","Anoka-Hennepin School District","http://www2.ed.gov/about/offices/list/ocr/docs/investigations/05115901.html","Minnesota","Title IX","Anoka",55303,45.208833,-93.390967
"Consent Decree in Doe and United States v. Anoka-Hennepin School District (D. Minn.)","Sex based discrimination at educational institutions","http://www.justice.gov/crt/about/edu/documents/anokaconsentdec.pdf","Minnesota","Department of Justice ","Anoka",55303,45.208833,-93.390967
"Title IX & Title IV: Complaint in Intervention in Doe and United States v. Anoka-Hennepin School District (D. Minn.)","Sex based discrimination at educational institutions","http://www.justice.gov/crt/about/edu/documents/anokacompint.pdf","Minnesota","Department of Justice ","Anoka",55303,45.208833,-93.390967
"Clery Act Report: Minnesota State University",,"http://studentaid.ed.gov/about/data-center/school/clery-act#msu","Minnesota","Clery ","Mankato",56001,44.147335,-93.997707
"Title IX: Complaint in Intervention in Lovins and United States v. Pleasant Hill Public School District R-III (W.D. Mo.)","Sex based discrimination at educational institutions","http://www.justice.gov/crt/about/edu/documents/lovinscom.php","Missouri","Department of Justice ","Pleasant Hill",64080,38.786501,-94.254171
"Title IX: Sexual Harassment: University of Montana-Missoula","Montana Resolution and Agreement","http://www2.ed.gov/about/offices/list/ocr/docs/investigations/10126001.html","Montana","Title IX","Missoula",59812,46.860067,-113.985208
"Title IX & Title IV: Letter of Findings in University of Montana-Missoula (D. Mt.)","http://www.justice.gov/crt/about/spl/documents/missoulafind_5-9-13.pdf","Montana","Department of Justice ","Missoula",59812,46.860067,-113.985208
"Settlement Agreement between DOJ and University of Montana's Office of Public Safety","Settlement Agreement between DOJ and University of Montana's Office of Public Safety to implement improved policies provide increased training and modify practice in order to improve response and sexual assault and ensure that there is no gender bias.","http://www.justice.gov/crt/about/spl/documents/missoulasettle_5-9-13.pdf","Montana","Department of Justice ","Missoula",59812,46.860067,-113.985208
"Letter of Findings in University of Montana-Missoula (D. Mt.)","Sex based discrimination at educational institutions","http://www.justice.gov/crt/about/edu/documents/montanaletter.pdf","Montana","Department of Justice ","Missoula",59812,46.860067,-113.985208
"Clery Act Report: Franklin Pierce University",,"http://studentaid.ed.gov/about/data-center/school/clery-act#fpu","New Hampshire","Clery ","Rindge",3461,42.778973,-72.055538
"Clery Act Report: The College of New Jersey",,"http://studentaid.ed.gov/about/data-center/school/clery-act#cnj","New Jersey","Clery ","Ewing Township",8618,40.268835,-74.78091
"Clery Act Report: Ramapo College of New Jersey",,"http://studentaid.ed.gov/about/data-center/school/clery-act#ramapo","New Jersey","Clery ","Mahwah",7430,41.082065,-74.174622
"Title IX: State University of New York (SUNY) Compliance Review","SUNY's Title IX Compliance Review","http://www2.ed.gov/about/offices/list/ocr/docs/investigations/02116001-a.html","New York","Title IX","Albany",12246,42.6472947,-73.749841
"Title IX: State University of New York (SUNY)  Resolution Agreement","SUNY's Title IX Resolution Agreement","http://www2.ed.gov/about/offices/list/ocr/docs/investigations/02116001-b.html","New York","Title IX","Albany",12246,42.6472947,-73.749841
"Title IX: West Contra Costa Unified School District Press Release","Press release: West Contra Costa","http://www.ed.gov/news/press-releases/us-department-education-reaches-agreement-west-contra-costa-unified-school-distr","California","Title IX","Richmond",94804,37.933832,-122.358491
"Title IX: City University of New York (CUNY) Resolution Letter","City University of New York Resolution Letter","http://www2.ed.gov/about/offices/list/ocr/docs/investigations/02062094.html","New York","Title IX","New York",10017,40.75074,-73.973707
"Title IX: Memorandum of Law in A.B. v. Rhinebeck Central School District & Thomas Mawhinney. (S.D. N.Y.)","http://www.justice.gov/crt/about/edu/documents/rcsdreply.pdf","New York","Department of Justice ","Rhinebeck",12572,41.925146,-73.901224
"Clery Act Report: Dominican College of Blauvelt",,"http://studentaid.ed.gov/about/data-center/school/clery-act#dcb","New York","Clery ","Orangeburg",10962,41.04762,-73.95031
"Clery Act Report: Paul Smith's College of Arts & Sciences",,"http://studentaid.ed.gov/about/data-center/school/clery-act#paulsmith","New York","Clery ","Brighton",12970,44.437451,-74.25305
"Clery Act Report: Wake Forest University",,"http://studentaid.ed.gov/about/data-center/school/clery-act#wfu","North Carolina","Clery ","Winston-Salem",27106,36.129842,-80.28145
"Clery Act Report: University of North Dakota",,"http://studentaid.ed.gov/about/data-center/school/clery-act#und","North Dakota","Clery ","Grand Forks",,47.922891,-97.076801
"Title IX: Notre Dame College","Notre Dame College","http://www2.ed.gov/about/offices/list/ocr/docs/investigations/15096001.html","Ohio","Title IX","South Euclid",44121,41.506455,-81.516303
"Clery Act Report: Miami University of Ohio",,"http://studentaid.ed.gov/about/data-center/school/clery-act#muo","Ohio","Clery ","Oxford",45056,39.510533,-84.730877
"Clery Act Report: Notre Dame College of Ohio",,"http://studentaid.ed.gov/about/data-center/school/clery-act#notredame","Ohio","Clery ","South Euclid",44121,41.506455,-81.516303
"Clery Act Report: The Ohio State University",,"http://studentaid.ed.gov/about/data-center/school/clery-act#osu","Ohio","Clery ","Columbus",43210,40.013842,-83.031085
"Clery Act Report: Okahoma State University",,"http://studentaid.ed.gov/about/data-center/school/clery-act#oklahomastate","Oklahoma","Clery ","Stillwater",74074,36.127024,-97.073722
"Clery Act Report: Oregon State University",,"http://studentaid.ed.gov/about/data-center/school/clery-act#oregon","Oregon","Clery ","Corvallis",97331,44.563736,-123.279475
"Title IX: Settlement Agreement in Junior Doe et al. & United States v. Allentown School District (E.D. Pa.)","Sex based discrimination at educational institutions","http://www.justice.gov/crt/about/edu/documents/allentownconsent.pdf","Pennsylvania","Department of Justice ","Allentown",18102,40.603092,-75.4665125
"Clery Act Report: LaSalle University",,"http://studentaid.ed.gov/about/data-center/school/clery-act#lasalle","Pennsylvania","Clery ","Philadelphia",19141,40.039192,-75.155176
"Clery Act Report: Lincoln University",,"http://studentaid.ed.gov/about/data-center/school/clery-act#lincoln","Missouri","Clery ","Lincoln University",19352,38.564674,-92.169392
"Clery Act Report: Slippery Rock University",,"http://studentaid.ed.gov/about/data-center/school/clery-act#slipperyrock","Pennsylvania","Clery ","Slippery Rock",16057,41.062814,-80.042016
"Clery Act Report: University of Pennsylvania",,"http://studentaid.ed.gov/about/data-center/school/clery-act#upenn","Pennsylvania","Clery ","Philadelphia",19104,39.952219,-75.193214
"Clery Act Report: Clemson University",,"http://studentaid.ed.gov/about/data-center/school/clery-act#clemson","South Carolina","Clery ","Clemson",29634,34.669578,-82.837187
"Clery Act Report: South Dakota State University",,"http://studentaid.ed.gov/about/data-center/school/clery-act#sdsu","South Dakota","Clery ","Brookings",57006,44.318573,-96.782122
"Consent Decree in Lopez and United States v. Metropolitan Nashville School District (M.D. Tenn)","Sex based discrimination at educational institutions","http://www.justice.gov/crt/about/edu/documents/lopezconsentdecree.pdf","Tennessee","Department of Justice ","Nashville",37204,36.121,-86.766938
"Memorandum of Law in support of Motion for Summary Judgment in Lopez and United States v. Metropolitan Nashville School District (M.D. Tenn)","Sex based discrimination at educational institutions","http://www.justice.gov/crt/about/edu/documents/lopezmemoinsuppmsj.pdf","Tennessee","Department of Justice ","Nashville",37204,36.121,-86.766938
"Title IX: Reply Brief in support of Motion for Summary Judgment in Lopez and United States v. Metropolitan Nashville School District (M.D. Tenn)","Sex based discrimination at educational institutions","http://www.justice.gov/crt/about/edu/documents/lopezreplymsjredact.pdf","Tennessee","Department of Justice ","Nashville",37204,36.121,-86.766938
"Clery Act Report: Northwest Vista College",,"http://studentaid.ed.gov/about/data-center/school/clery-act#nwvista","Texas","Clery ","San Antonio",78251,29.469275,-98.706206
"Clery Act Report: Saint Philip's College",,"http://studentaid.ed.gov/about/data-center/school/clery-act#stphilips","Texas","Clery ","San Antonio",78203,29.414141,-98.45352
"Clery Act Report: Salem International University",,"http://studentaid.ed.gov/about/data-center/school/clery-act#salem","West Virginia","Clery ","Salem",26426,39.284951,-80.568496
"Clery Act Report: Schreiner University",,"http://studentaid.ed.gov/about/data-center/school/clery-act#schreiner","Texas","Clery ","Kerrville",78028,30.031826,-99.130819
"Clery Act Report: Tarleton State University",,"http://studentaid.ed.gov/about/data-center/school/clery-act#tarleton","Texas","Clery ","Stephenville",76401,32.21492,-98.214726
"Clery Act Report: University of Texas at Arlington",,"http://studentaid.ed.gov/about/data-center/school/clery-act#uta","Texas","Clery ","Arlington",76019,32.730468,-97.114774
"Clery Act Report: University of Utah",,"http://studentaid.ed.gov/about/data-center/school/clery-act#utah","Utah","Clery ","Salt Lake City",84112,40.764937,-111.842102
"Clery Act Report: University of Vermont",,"http://studentaid.ed.gov/about/data-center/school/clery-act#uvm","Vermont","Clery ","Burlington",5405,44.477853,-73.196464
"Clery Act Report: Virginia Polytechnic Institute and State University",,"http://studentaid.ed.gov/about/data-center/school/clery-act#vatech","Virgina","Clery ","Blacksburg",24061,37.228384,-80.423417
"Clery Act Report: Liberty University",,"http://studentaid.ed.gov/about/data-center/school/clery-act#liberty","Virginia","Clery ","Lynchburg",24502,37.353053,-79.179497
"Clery Act Report: University of Virginia",,"http://studentaid.ed.gov/about/data-center/school/clery-act#uva","Virginia","Clery ","Charlottesville",,38.033553,-78.507977
"Clery Act Report: Washington State University",,"http://studentaid.ed.gov/about/data-center/school/clery-act#washington","Washington ","Clery ","Pullman",,46.731937,-117.154422
"Clery Act Report: Georgetown University",,"http://studentaid.ed.gov/about/data-center/school/clery-act#georgetown","Washington D.C.","Clery ","Washington",20057,38.907609,-77.072258
"Clery Act Report: San Antonio College",,"http://studentaid.ed.gov/about/data-center/school/clery-act#sanantonio","Texas","Clery ","San Antonio",78212,29.446359,-98.497857
"Clery Act Report: West Virginia University",,"http://studentaid.ed.gov/about/data-center/school/clery-act#wvu","West Virginia","Clery ","Morgantown",26506,39.63614,-79.955936
"Clery Act Report: West Virginia Wesleyan College",,"http://studentaid.ed.gov/about/data-center/school/clery-act#wvwc","West Virginia","Clery ","Buckhannon",26201,38.990616,-80.217493
"Clery Act Report: University of Wisconsin-Green Bay",,"http://studentaid.ed.gov/about/data-center/school/clery-act#wisgb","Wisconsin","Clery ","Green Bay",54311,44.532302,-87.921352